{
  "run_id": "20260718-factory_ego-gemma4-e2b-full20-r1",
  "unit_id": "f003_w009_injection_molding",
  "method": "temporal_grounding",
  "interval_convention": "half-open_seconds",
  "events": {
    "remove_yellow_parts_from_mold": [
      {
        "start_s": 0.0,
        "end_s": 0.1
      }
    ],
    "hold_metal_rod_at_mold": [
      {
        "start_s": 0.0,
        "end_s": 0.1
      }
    ]
  }
}
