{
  "run_id": "20260716-factory_ego-marlin-2b-current-sop-delta12-r1",
  "unit_id": "f006_w005_compression_molding",
  "method": "temporal_grounding",
  "interval_convention": "half-open_seconds",
  "events": {
    "carry_and_align_silver_mold_on_press_table": [
      {
        "start_s": 0.0,
        "end_s": 9.8
      }
    ],
    "operate_blue_lower_control_lever": [
      {
        "start_s": 18.0,
        "end_s": 19.6
      }
    ]
  }
}
