{
  "run_id": "20260718-factory_ego-qwen3.5-2b-full20-r1",
  "unit_id": "f002_w005_garment_ironing",
  "method": "temporal_grounding",
  "interval_convention": "half-open_seconds",
  "events": {
    "place_folding_board": [
      {
        "start_s": 0.0,
        "end_s": 1.0
      }
    ],
    "fold_shirt_around_board": [
      {
        "start_s": 1.0,
        "end_s": 10.0
      }
    ],
    "turn_and_neaten_folded_shirt": [
      {
        "start_s": 1.0,
        "end_s": 10.0
      }
    ],
    "stack_folded_shirt": [
      {
        "start_s": 11.0,
        "end_s": 14.0
      }
    ]
  }
}
