{
  "run_id": "20260717-factory_ego-marlin-2b-final-det-r1",
  "unit_id": "f004_w005_overlock_seaming",
  "method": "temporal_grounding",
  "interval_convention": "half-open_seconds",
  "events": {
    "guide_pink_fabric_under_presser_foot": [
      {
        "start_s": 14.0,
        "end_s": 16.8
      }
    ],
    "remove_pink_fabric_from_sewing_machine": [
      {
        "start_s": 17.0,
        "end_s": 19.6
      }
    ],
    "take_next_pink_fabric_from_pile": [
      {
        "start_s": 2.4,
        "end_s": 3.3
      }
    ],
    "spread_and_align_pink_fabric_edges": [
      {
        "start_s": 13.5,
        "end_s": 16.8
      }
    ],
    "position_pink_fabric_at_presser_foot": [
      {
        "start_s": 13.5,
        "end_s": 16.8
      }
    ]
  }
}
