{
  "run_id": "20260716-factory_ego-marlin-2b-current-sop-delta12-r1",
  "unit_id": "f002_w005_garment_ironing",
  "method": "temporal_grounding",
  "interval_convention": "half-open_seconds",
  "events": {
    "place_folding_board": [
      {
        "start_s": 0.0,
        "end_s": 5.0
      }
    ],
    "fold_shirt_around_board": [
      {
        "start_s": 6.0,
        "end_s": 11.0
      }
    ],
    "turn_and_neaten_folded_shirt": [
      {
        "start_s": 12.0,
        "end_s": 15.0
      }
    ],
    "stack_folded_shirt": [
      {
        "start_s": 16.0,
        "end_s": 19.0
      }
    ]
  }
}
