{
  "run_id": "20260717-factory_ego-qwen3-vl-4b-stratified6-r1",
  "unit_id": "f001_w011_metal_stamping",
  "method": "temporal_grounding",
  "interval_convention": "half-open_seconds",
  "events": {
    "feed_metal_strip_into_press": [
      {
        "start_s": 0.0,
        "end_s": 2.0
      }
    ],
    "walk_to_next_press": [
      {
        "start_s": 15.0,
        "end_s": 20.0
      }
    ],
    "pick_up_metal_sheets": [
      {
        "start_s": 0.0,
        "end_s": 2.0
      }
    ],
    "align_metal_sheet_stack": [
      {
        "start_s": 0.0,
        "end_s": 20.0
      }
    ]
  }
}
