{
  "run_id": "20260718-factory_ego-qwen3.5-4b-full20-r1",
  "unit_id": "f002_w003_fabric_folding",
  "method": "temporal_grounding",
  "interval_convention": "half-open_seconds",
  "events": {
    "take_garment_from_stack": [
      {
        "start_s": 0.0,
        "end_s": 2.0
      }
    ],
    "fold_garment_sides": [
      {
        "start_s": 1.0,
        "end_s": 5.0
      }
    ],
    "pick_up_hanger": [
      {
        "start_s": 1.0,
        "end_s": 3.0
      }
    ]
  }
}
