{
  "run_id": "20260718-factory_ego-qwen3.5-2b-full20-r1",
  "unit_id": "f002_w002_garment_bagging",
  "method": "temporal_grounding",
  "interval_convention": "half-open_seconds",
  "events": {
    "pick_garment_from_stack": [
      {
        "start_s": 1.0,
        "end_s": 4.0
      }
    ],
    "insert_garment_into_bag": [
      {
        "start_s": 1.0,
        "end_s": 4.0
      }
    ],
    "seal_bag_flap": [
      {
        "start_s": 11.4,
        "end_s": 16.0
      }
    ],
    "place_package_to_right": [
      {
        "start_s": 11.0,
        "end_s": 14.0
      }
    ]
  }
}
