{
  "run_id": "20260717-factory_ego-marlin-2b-final-det-r1",
  "unit_id": "f005_w001_semi_automatic",
  "method": "temporal_grounding",
  "interval_convention": "half-open_seconds",
  "events": {
    "place_ring_part_on_machine_spindle": [
      {
        "start_s": 14.0,
        "end_s": 18.0
      }
    ],
    "arrange_white_cord_by_hand": [
      {
        "start_s": 6.5,
        "end_s": 8.5
      }
    ],
    "press_illuminated_control_switch": [
      {
        "start_s": 10.0,
        "end_s": 11.5
      }
    ],
    "reach_and_return_with_black_tweezers": [
      {
        "start_s": 14.0,
        "end_s": 15.0
      }
    ],
    "position_black_tweezers_at_white_cord": [
      {
        "start_s": 14.0,
        "end_s": 15.0
      }
    ],
    "tuck_white_cord_with_black_tweezers": [
      {
        "start_s": 14.5,
        "end_s": 18.5
      }
    ],
    "reach_toward_control_panel_top": [
      {
        "start_s": 10.0,
        "end_s": 11.0
      }
    ]
  }
}
