{
  "run_id": "20260718-factory_ego-marlin-2b-full20-r1",
  "unit_id": "f004_w006_curvilinear_seam",
  "method": "temporal_grounding",
  "interval_convention": "half-open_seconds",
  "events": {
    "align_curved_gray_fabric_edges": [
      {
        "start_s": 0.0,
        "end_s": 3.5
      }
    ],
    "position_gray_fabric_at_presser_foot": [
      {
        "start_s": 4.0,
        "end_s": 6.7
      }
    ],
    "guide_gray_fabric_under_presser_foot": [
      {
        "start_s": 4.0,
        "end_s": 19.0
      }
    ]
  }
}
