{
  "run_id": "20260716-factory_ego-marlin-2b-new10-query-r2",
  "unit_id": "f005_w011_cnc_machine",
  "method": "temporal_grounding",
  "interval_convention": "half-open_seconds",
  "events": {
    "carry_square_fixture_to_cnc_opening": [
      {
        "start_s": 1.2,
        "end_s": 5.0
      }
    ],
    "position_square_fixture_inside_cnc": [
      {
        "start_s": 10.0,
        "end_s": 13.0
      }
    ],
    "press_illuminated_orange_control": [
      {
        "start_s": 6.8,
        "end_s": 7.5
      }
    ],
    "press_lower_right_silver_control": [
      {
        "start_s": 10.0,
        "end_s": 13.0
      }
    ],
    "close_cnc_sliding_door": [
      {
        "start_s": 11.4,
        "end_s": 13.0
      }
    ],
    "move_orange_square_fixture_on_table": [
      {
        "start_s": 14.0,
        "end_s": 19.0
      }
    ]
  }
}
