{
  "run_id": "20260717-factory_ego-qwen3-vl-4b-stratified6-r1",
  "unit_id": "f006_w005_compression_molding",
  "method": "temporal_grounding",
  "interval_convention": "half-open_seconds",
  "events": {
    "carry_and_align_silver_mold_on_press_table": [
      {
        "start_s": 0.0,
        "end_s": 2.0
      }
    ],
    "operate_blue_lower_control_lever": [
      {
        "start_s": 15.5,
        "end_s": 18.0
      }
    ]
  }
}
