{
  "run_id": "20260715-factory_ego-marlin-2b-annotation-delta5-r1",
  "unit_id": "f002_w003_fabric_folding",
  "method": "temporal_grounding",
  "interval_convention": "half-open_seconds",
  "events": {
    "take_garment_from_stack": [
      {
        "start_s": 7.5,
        "end_s": 8.5
      }
    ],
    "fold_garment_sides": [
      {
        "start_s": 12.0,
        "end_s": 17.0
      }
    ],
    "pick_up_hanger": [
      {
        "start_s": 18.0,
        "end_s": 19.6
      }
    ]
  }
}
