{
  "run_id": "20260718-factory_ego-marlin-2b-full20-r1",
  "unit_id": "f003_w005_metal_casting",
  "method": "temporal_grounding",
  "interval_convention": "half-open_seconds",
  "events": {
    "carry_casting_bundle": [
      {
        "start_s": 3.5,
        "end_s": 7.0
      }
    ],
    "put_casting_into_crate": [
      {
        "start_s": 4.0,
        "end_s": 5.0
      }
    ],
    "pick_up_hammer": [
      {
        "start_s": 7.5,
        "end_s": 9.0
      }
    ],
    "hammer_casting": [
      {
        "start_s": 10.0,
        "end_s": 19.0
      }
    ]
  }
}
