{
  "run_id": "20260715-factory_ego-marlin-2b-annotation-delta5-r1",
  "unit_id": "f003_w009_injection_molding",
  "method": "temporal_grounding",
  "interval_convention": "half-open_seconds",
  "events": {
    "event_001": [
      {
        "start_s": 4.0,
        "end_s": 9.0
      }
    ],
    "event_002": [
      {
        "start_s": 9.5,
        "end_s": 11.0
      }
    ]
  }
}
